,Unnamed: 0,title,summary,installs,score,ratings,reviews,size,androidVersion,developer,developerId,genre,genreId,icon,contentRating,containsAds,released,updated,version,comments,similarApps,url
10,com.openvidu_react_native,Edutechs,Personal Edtech AI Assistant,500,0.0,,0,82M,5.0,M. Ekram,M.+Ekram,Education,EDUCATION,https://play-lh.googleusercontent.com/aI5BjESHq5aF-vgIJhAXdpbrMBrAs4LjitLC8g4Rnu3v0ZekazS_XSit168-jwXlj5w,Everyone,False,"Oct 21, 2020",1651858887,44.9,"[""This is amazing. I am using this under Mindmax. An English Language teacher for Edexcel and Cambridge. Well, found this app amazing with certain issues... Firstly students don't get notification on their ' working sides', for example... Exam markings and online assignments... And secondly, the fees system is a bit messed up... And also I cant add students phone no and their guardians number manually. Being a betatester, I hope these will be fixed in the near future."", 'A very good app. I am using this as a student. Video conferences are outstanding. Learning from home in this Quarantine pandemic cvoid-19. This is really an outstanding app!', 'Excellent app for a educational institute or a individual who wants to learn learn/teach online without any hassle. Wish Edutech a bright future.', 'Great 👍']","['com.zenkit.zenkit', 'com.mergemobile.fastfield', 'io.siteplan.sytex', 'com.zerion.apps.iform.main', 'com.mobimate.cwttogo']",https://play.google.com/store/apps/details?id=com.openvidu_react_native&hl=en&gl=us
11,com.roots.edulive,ROOTs Edu,"Learning App for SSC, HSC, Admission Students",50000,4.116279,2047.0,23,163M,5.0,ROOTs IT,ROOTs+IT,Education,EDUCATION,https://play-lh.googleusercontent.com/vOnJe5MIPsFlWPeeDvRtIPFSc3ZtNAr2-VIDlDwsHyW0jDOuy8ZcxMsB8nLfcYJ7Fmk,Everyone,False,"Aug 11, 2020",1651135196,2.10.15,"[""It's suggesting me to add the name of my institution. But when I'm adding it, it says to select a proper institution name. I've tried with other institution's names too but still it doesn’t work. And also there is no option to skip it therefore I'm unable to use the app. Please fix this problem as soon as possible."", ""I really like this app very much. But it will be more good if there is a option for downloading the recorded free class. Please,, add this feature to help more the poor students like me... Because MOBILE DATA aren't available for all time in our mobile...You should add this downloading option so that we can download this video by FREE WIFI and can watch later while staying at our home,,,and I think it will be very helpful for the poor students...I hope you will reply soon in my review"", 'Very easy to use. Classes are so helpful. Even the free ones are so good. The best thing is full syllabus of SSC/HSC completely free. And the paid classes are on another level.', ""Such a great app! The teachers are dedicated and know how to teach. Their service is superb. But this app has some bugs which need to be fixed. Recently, I can't enter this app. I purchase their course once and want to purchase more but can't enter the app. What to do??"", ""User interface is smooth but my 'Doubt Solve' isn't working at all. When I enter a photo of my problem it doesn't show anything. The inbox (doubt solve interface) remains empty all the time. Please fix the issue."", 'I Ioved it. In this pandemic there were a lot of Facebook groups for online classes. But ROOTs is the 1st one who provided fully inapp facilities without any Facebook distraction. Lot of Thanks!🤍', ""The app's response in every case is too slow. Besides being an student of English version, I could not get any benefits from this app."", 'Im a poor student of hsc 2022 My exam is near... I was vary tanse for it. But the help of roots edus classes I have complete a lots of topic. Im vary thanked full to roots edu for its free course. I will always recommended roots edu As the best education app for all student. If you guys Trust me then got for it and improve yourself.If you dont trust me then try one time. After that you will get the answer by your own experience 🥰 Good luck RooTs Edu💥💥', ""It's providing quality educative video lectures from SSC till Admission. They have qualified instructors with concurrent technology. I think they'll be tremendously critical for the future. They also provide free lectures so it's worth a try."", ""Its very helpful But i have some problem I enrolled in a course a long time ago I need to watch the record classes but clicking doesn't change and the class doesn't come please solve this problem"", 'What can I say about your video player!! It is definitely annoying for those who have bought the course with money. Please update the player.', 'This Organization is really helpful for people who doesn’t have the ability to afford their tution fees on a monthly basis. They offer quality content and the respected tutors are very nice and helpful!', ""There is some network issues and no option like history. I can't see what I watched last time. please add this."", ""This app is telling me to add my institution name from the drop down but i can't fix it. It isn’t working."", 'I have subscribed for the medical admission 2021 in the app, but many classes for the biology and chemistry, and all the classes for english and general knowledge are unavailable along with many other problems. I kindly request the authority to fix it and give a helping hand to the one facing the problem.', ""I registered in the app before. Than I deleted this app for a reason. Today after downloading this app, I tried to register. But every time I try to register, it says, 'user already registered'. Problem is, there are no other function to enter the app."", 'I downloaded the app but the video of classes are not opening what the hack with this app Why the videos are not playing 😤 I reinstall this app again but this time I get the same problem help us', ""It's an amazing app and I am having a great experience after using this app ...And this is very much helpful for learning things easily..."", 'this app is really helpful for students. Students can solve all kind problem sitting at home', ""I can't open the cls note though I have pdf reader in my phone.when I click it shows error.can u tell me which app can show the cls note pdf?I am badly in need of it.."", ""Your app isn't fully developed. The video player is not so much smart. This sould be smarter. There are few free videos. Almost, effective videos are paid. If you enroll a course, then this app is for you. But, if you a free user, then this app is not for you. 😅"", 'You are very bad. Your class doesn’t start. My money is totally wasted to buy subscription in your apps', ""Amazing app.Distraction free..... But it will be really helpful if some more classes were added. Hope it'll happen soon.. আর শাওন ভাইয়ের অর্গানিক কোর্সে কিছু নতুন ক্লাস এবং এক্সাম আসার কথা। অইগুলা কি আসবে? 🙃"", 'Such a irritating issue.i can not submit my college name and the app is not responding also.at last trying 15 times the app is not opening also', ""The user interface is very nice. But there is a problem with the app. When you choose or enroll in any course, after selecting a subject, I can't choose the class I want to do. It directly shifts to the classes, not letting us to choose which class I wanna do of that particular subject. Hope you guys will bring some changes in the app to solve this issue."", 'THE APP GETS CRASHED OFTEN.PLEASE UPGRADE IT Updated the app but no it is saying server error, please try again later!🙂 Please give a proper soloution,please!', 'Most helpful apk so far. Thanks a billion, please keep updating and add new contents!!', 'I have taken subscription ...but on the second day the classes are not viewing ...what should I do,plz help🙂🙂', 'The class was really good. In Corona pidemic, when it is not possible to go out of the house to a teacher or coaching in a coaching center, the online class is a great benefit for our students. Although the online class was already there. But in my opinion, its importance has increased many times during this time. Many beautiful and very important apps for our students. In a word, great.', ""It's really good. The teachers teaches very well."", ""App isn't optimize . free course all video are not show..."", 'The Lectures were too good for me that i can easily understand.I will get subscription soon ❤️', ""Using this very frustrating...🙂Video isn't playing after wait long time"", 'I think This platform is very helpful to learn something new..', 'Very useful app to learn.Its provide us free class without payment for hsc course.', 'The app doesn’t work. I brought a course. At first it was working fine.But with the new update, it’s completely trash.', 'Undoubtedly best app. But I need to login everytime and OTP comes so late. Sometimes free classes are not available. Please fix these as soon as possible.', 'Those teacher are usually thinking about money..Make more free class on to the app AND this roots edu app is not for poor boys...Always thinking about money..plz stop your useless bus ness', 'No video is starting all is very slow many many problem', ""Doubt solving feature is, just insane🔥.. I request to Riddha vaiya, Don't off this feature, Please. And another request to add some extra benefit in apps recorded video, like YouTube. In YouTube, we can move easily to our desired area by seeing the video playback in front, when we slide the video line. Long duration video is embarrassing when we see it for 2nd time. This feature can save students valuable time. (Just personal opinion)""]","['com.oneous.bangladict', 'com.mobtop.android.bangla', 'com.qanda.learnroom', 'com.myanlearn_for_students', 'com.rove.rovepapers']",https://play.google.com/store/apps/details?id=com.roots.edulive&hl=en&gl=us
12,com.render.reskills,ReSkills,"An Edtech company, focuses on education-based service in Southeast Asia.",100000,0.0,,0,285M,6.0,ReSkills EdTech,ReSkills+EdTech,Education,EDUCATION,https://play-lh.googleusercontent.com/3wFn-mnHFTk6lqyzhX0y6M1YQDK6KCOShqf2YUlSS8bqQ6fC1UYnmGMP1RS7eofNaGM,Everyone,True,"Feb 6, 2021",1652201559,8.1.3,"['Issues: Need to login every time you open the app. The app will log you out after a while of staying at the main menu/home page. Every so often the app will crash when joining a live session. The only fix is using the actual website to join. Saving certificates, providing actual assessment and evaluation needs to use the website not the app.', ""Overall it's a good app but maybe you could give some notification to us at least? About the registered events so we don't need make a schedule in calendar or alarm in order to attend it in a easily way:) hope this advice can be heard and seen, i'll be giving this app 5 stars if you do so and i already told my family and friends to download this useful app to never ending learning"", 'This app is really something. It will trach you and nourish you. I really like interacting with the coach and other people. And the ideas presented from different countries is refreshing.', 'ReSkills is a great learning app especially at this new normal. It provides opportunities for students grasping education online and even offers free webinars with e-certificates. Further, the technical team/support is very responsive and committed to the service.', 'So sad that last time the app is very good but now its not functioning well. I have attended the class from the start but the assessment is not given to me which in fact I opened it in the web.', 'Thnak you so much reskills. It is a very good plarform that enrich my knowledge and skills. It helps a lot in my study. VERY RECOMMENDED', ""I use it for our work immersion and it exceeds my expectations. The coaches are accommodating and inspiring. I just hope there's a feature where I can follow coaches or other attendees. But overall, it's a great app."", 'Your time will never be wasted in reskills. This apps gives you so many learnings. It can helps us develop our career..', ""At first, it's really good and even the coaches and assessment to get the certificate but when I updated it, I can't open the app. I even try to redownload it but it really didn't open."", ""Please, Find the problem on this app because i can't process any transaction and it'll stressing me out."", 'Learning is not really helpful as the trainers are not from India. Each topics are explained in other languages except English. I would recommend not to use this app particularly for students.', ""I don't know what kind of app is this. it's look like used by some people for scam. By hiring people to watch, but always with new accounts. It's kinda weird. The logic is that if you create a new account you have to use new email and number, so what?"", 'I had reinstall for 3 times but still stuck on cover page..', ""This is the worst learning app I've ever seen in my life. If there is any possible I'll give zero star for this app. No proper live session. No proper class varieties, etc., please don't suggest to anyone paricularly for students and their parents."", 'App and website not working still on logo and login.', ""I have been using this app for some time and it didn't seem useful for me. Notifications which I get is wrong, I couldn't attend the Iive sessions."", ""Best learning platform for those who wants to discover and gain new interests. You can meet different coaches with different expertise, it helps me to learn new things . You can join classes with different topics like communication, personal development, leadership and many more. I hope you'll continue to provide knowledge and information that will surely help us. It's a nice idea that you add quizzes after the discussion so that we can determine if we learned something from the class."", ""Great apps but can add more features especially a record for the completed online class and onLIVE class. Also when watching Live classes thru the Apps, the screen is bigger, not fit my phone screen. I also could not type my comment at the comment section. Attended 2 Live classes but didn't wait both till the end so I got no certificate."", 'Very informative sessions and topics and coaches are very good in the aspect of delivering their topics.', 'This app need a major optimization!!! It keeps freezing my phone... Evertime i open it it just stuck on the logo... If you open the chat box there is no button back...the only option is to get out from the meeting.... Wow... You cant even use the zoom option.. And takes forever to get back to the meeting.', ""Best learning online platform right now! You can get e-certificates and learn for free. That's a thumbs up for me. The coaches are very great at explaining and approachable. I can really say they're professionals and experienced ,the way they talk, explain,they're legit information givers. This is really a game changer. Highly recommended guys."", 'Dapat -6666 star tong app nato eh, bug fixed daw tas d makapasok are you gagoing me? I cant open the app still in the loading screen', 'This app get more knowledge and having certificate. Thank you', '100 percent accurate and advance learning', 'the app is not properly responding.', 'Very informative and amazing app❤️', 'ReSkills, a global platform to build a professional, personal and academic career. Impressive, effective, rewarding and knowledge-enhancing sessions. So, we are evaluated and take assessments for certification. LEUTRIM BRAHA', 'A good learning app with LIVE sessions... really helpful for career and skill development.', ""Excellent app and content. Suitable for self improvement in today's challenging working environment."", 'Fantastic tool for e-learning, from the best in class coaches.', 'Able to interact with coach instantly. How amazing is this learning.', 'Always had an bug. I cant enter many times', 'Been learning from ReSkills for some time, this is really good.', 'This app is very useful to me as an intern I really need webinars to attend and this app helps me a lot. The coaches,host and technical team here are very calm and handle people with care.', 'What to expect from a free online learning app, which provides self learning enhancement in all kinds of subjects and also leadership skills too.. this is beneficial for businessman as well. Hope you guys continue to create more content for vast population. I myself looking forward to learn foreign language, especially Japanese Language.', 'Recommending this app to anyone to the world, it will be your best learning platform', 'its a good app but it need an upgrade', 'Worst experience in my browsing and Online zoom meet up. Needs to be well informed ahead of time which makes it at risk for my ethnicity to be at line. I will rethink on this one.', 'I Give 4 stars because when I join onlive webinar I cannot open the chat box, though we all know that connection is sometimes the problem, but overall is I really enjoy watching the lessons, I learned a lot and already got my E-certificate. You can also rewatch past webinars.. The speakers are so lively and patient.. I hope that this app will upgrade after a month or a year..', 'Reskills provides me unlimited learning, i love it!']","['com.emeritus.mobile', 'org.domestika', 'com.chegg', 'com.mobile.simplilearn', 'com.instapreps']",https://play.google.com/store/apps/details?id=com.render.reskills&hl=en&gl=us
13,com.edtechme.presspadnews,EdTech Middle East,Technology is changing the face of education all over the world.,5,0.0,,0,11M,4.2,Moftah Publishing,Moftah+Publishing,Education,EDUCATION,https://play-lh.googleusercontent.com/_8s3ICY2Si2-YKtdp05Uon6K-6e270MeNKJml1I6vkimK8mFpiv-zCfjmLgfA6hsWJUA,Everyone,True,"Dec 19, 2019",1576788351,2.5.1,[],"['com.olyappunited', 'com.emeritus.mobile', 'com.americasarmy.app.careernavigator', 'com.armynoncomtools.leadersbook', 'com.himumsaiddad.armyfit']",https://play.google.com/store/apps/details?id=com.edtechme.presspadnews&hl=en&gl=us
14,com.lurningo.teamsbylurningo,Teams By Lurningo,Teams By Lurningo is the corporate learning platform from Schoolguru.,10000,2.3333333,1256.0,2,128M,5.0,TeamLease EdTech Ltd.,4933071823472176244,Education,EDUCATION,https://play-lh.googleusercontent.com/0ujRJ6EMknM1clq8dBy49bDTcMV2wVEytQ1HWTjVo4-zJyeZB-ghczObqbu4x2spiLY,Everyone,False,"Feb 20, 2020",1646399399,3.1.09,"['After the installation i am not able to open the app itself first i could open but after asking for the update i was not abled to update and now not even open', ""It was good but it takes lot of time to load a file. So I don't recommend this app, please don't install this app."", ""WORST APP * Why does this app ask permissions for my photos and media , storage ,calendar contacts and telephone. * why are these permissions compulsory. Why can't i access learning section without giving these permissions. Also, this app is not secure at all. My profile picture keeps changing itself. I tried changing password many times but the problem is not resolved. There might be many other bugs."", 'While this is a nice app to manage college learning, it is full of bugs and I have not seen any updates fixing them in the month that I have used it. There are frequent call drops as well.', 'Very bad app and not supported in some mobiles...And one of the bloody feature of the app is how the leaturer controls the students audio and video without the student permission, even though student make unmute themselves.Hope from this review make an update to remove the feature of controlling students mic.please bring that update from all the students...Execpt that app is good and getting some errors...', ""Worst app ever... The worst experience of attending online classes... This app doesn't load the live session part always shows no live sessions available.. the progress never gets updated... The worst experience."", 'Nice UI and all, but for some reason, I(and many of my friends) had to reinstall this app so that our courses are displayed. Hope this does not happen in the future.', ""This application needs serious updates. Major of them are:- 1. Don't show live classes sometime if they are live 2. Turns webcam & microphone automatically, without our permission. 3. Show connectior error, but we are connected to high speed internet at same time. 4. Material/Study part doesn't work. 5. UI is not clear for begginers. 6. Sometime there is login error. 7. Don't use zoom, if we want to use zoom then why are we here. Develop your own application and use it. 8. Huge diff. Bw App&Sit"", ""It's really a good app for.. online classes or any meetings as it contains all the details of the user.. and it doesn't struck or stops suddenly.. like other apps.. I preffer this app to all the students for better view..."", 'Some times it is unable to show live sessions even though the classes running it shows there is no live sessions for you. then we log it out and logging again then it shows live sessions ..', 'Something went back while going on cls it automatically turn to back to home screen.... But good app ...and we satisfied on clear online classes well good audible capable...ect', 'All the studnets are facing difficulty in joining classes. We have to relogin each time we have to attend a class, sessions do not get loaded, needs a lot of improvements.', 'This app is of no use .... the live sessions are never visible... connectivity issues are at peak .. My profile never gets updated...worst meeting app', 'Too much problems in this app many times it shows no live sessions but classes are started and also voice problems..', 'Worst app ever. I have to login again and again whenever my online classes starts. This app is not even works properly. Full wastage of time and data.', 'This is app is so dangerous because it uses zoom application for live classes inside it. It has several amount of bugs that should be fixed.', 'It works very poorly. Whenever I take a live session on this app, it is not visible. Which made it this. I would have made it better by speaking.', ""It is working too late and even my profile is not upadated till now and causing so inconvenience for the users... So I'm unsatisfied with this app ... Thank you!!"", 'Unable to take screenshot since last update please do something for it. There is no international meeting that you are showing it private .. please allow us to take screenshot...', 'It is a good and useful app.worth for it.but the security issues must be improved since any one can sign in and access our account by knowing the phone number', ""Worst app. To much of technical glitches. Tried to open a file still not able to do it😠😡 Don't know why i even gave 1 star."", ""We aren't allowed to take screenshots of our own classes due to security reasons.. Wowww that's an amazing feature"", 'Superb, excellent, awesome', 'I like this app because it give me time to complete my work while attending online class 😂. Not at all usefull.', 'This is wrost app ever.It never works properly,always showing ""can\'t connect to server"".', 'Very poor performance. You have to open it two to three time to open live session.', 'Worst app ever. I will give 1 star for this app because live sessions are shown after 15-20 minutes from schedule time.', 'It helps my son learn! WOAH... It is not all about the stylish way it is...It is all about how they make you learn:):):)', ""Worst app.Why does this application even exist.No use of using this it's just a waste of time.Keeps hanging everytime.Rejoing any live class is impossible 🤣.govt should ban this app instead of Chinese apps."", ""Very poor quality app... Your server can't bear the load of 50 students logged in together. Very Poor Quality I missed my first 3 Online Classes because of your server loading and loading."", 'Good to learn through lurningo but somewhat disturbance we are facing like updated of our schedule is lacking and other difficulties ....tq', 'The only inconvenience I have faced with this app is it works too late...apart from this it is helpful and easy to use ...Thank you', 'Great app.... really convinient for meetings.... on my view nothing is there to define this app as a worst one... really amazing and splendid one....', ""Worst app ever, it always shows unable to connect server and I'm using this app with my wifi.😡😡"", ""the new update is very frustating as it doesn't allow to take screenshots.. fux it!!"", 'Screen shot problem is coming, since If this application has been updated, first solve the problem.', 'Cannot open any pdf or document sent by my institution. Please check the app for any glitch.', 'Wonderful features ...no problem at all keep rocking and improve the app more and more ...🙂', 'Not much flexibility for the learner and need more improvements in chat options.', 'After update the screenshot facility is restricted which will cause too much of inconvenience to the users']","['com.swivl.android', 'uk.co.insite.team', 'com.teqneers.myteam', 'com.teamapp.teamapp', 'com.theteamplans']",https://play.google.com/store/apps/details?id=com.lurningo.teamsbylurningo&hl=en&gl=us
15,com.trusity,Trusity,Trusity is UAE’s first holistic digital learning space and an EdTech company.,10,0.0,,0,36M,5.0,Trusity Learning,Trusity+Learning,Education,EDUCATION,https://play-lh.googleusercontent.com/9GsJpIS4a8eeN6onQHNCBKfrpZNByYywiczZ3_xzZiYSba0MtT85UDqOEegRg-SA9A,Everyone,False,"Dec 2, 2021",1648203363,1.1,[],"['com.emeritus.mobile', 'co.iron.edstd', 'com.smartly.hybrid', 'com.skooly.app', 'com.varsitytutors.learningtools']",https://play.google.com/store/apps/details?id=com.trusity&hl=en&gl=us
