,Unnamed: 0,title,summary,installs,score,ratings,reviews,size,androidVersion,developer,developerId,genre,genreId,icon,contentRating,containsAds,released,updated,version,comments,similarApps,url
0,com.dellhoak.edtech,EdTech,You can use this app for study material Notes and more educational purposes.,500,0.0,,0,5.7M,6.0,DELLHOAK,DELLHOAK,Education,EDUCATION,https://play-lh.googleusercontent.com/3hPKZzEFWWuQpAKE6cvv6DBALbcf0zBB2-Rj-aSdQFGiUXvN2wRZFiFt58CoNDJSCVg,Everyone,False,"May 20, 2021",1621530534,1.0,"[""It doesn't work I downloaded the app but it doesn't work""]","['com.kharty.kharty', 'com.hosam.my_courses', 'studyhabitsnutritiontipsabitudinitanulmanyszokasok.cincotd4pza2mcw68gof42svi.yu5fl', 'com.ark_software.mathgen', 'com.trmapps.how_to_learn_faster_and_remember_more']",https://play.google.com/store/apps/details?id=com.dellhoak.edtech&hl=en&gl=us
1,com.a10minuteschool.tenminuteschool,10 Minute School - Online Learning Courses,"Explore online courses, tutorials and quizzes for class 1-12, admission and more",1000000,4.08,54691.0,339,159M,5.0,10 Minute School,6563426761511969761,Education,EDUCATION,https://play-lh.googleusercontent.com/olrMF2uNBZELtwPK_HpNHGWXEDEcrG-H8FKsiNPETaQ36r2SYScDYy7eGUUrl2dLdg,Everyone,False,"Jan 26, 2019",1651151841,3.8.4.4,"[""This is the best educational app in Bangladesh. It's so easy to use, there are many great educational and skill developing courses. But I have a suggestion, can you please add auto rotation feature? And when my phone's screen turns of in the middle of a video, it starts all over again. If you can fix this problem, it would be much appreciated"", ""Very very bad app that's why I'm giving you just a single star. I can't watch my downloaded videos offline. It has taken my huge data and time. Within 7 days of downloading this app it shows me update option and I'm unable to continue this app without updating it. Besides the download menu doesn't shows my downloaded videos."", 'This is avery good app for all class. But it have spme problems, first - the explanations is not available in the quizzes. And the other problem is that - the math of the app have, just the book examples. There not have any extra idea or mathematics. However, this app is a very useful app🥰🥰', ""It would be more useful if this app contained test paper and also exams except onlh quizzes. And also if there Isn’t any way to change the speed of the video. If there was, it would've been more helpful. Overall this app is not bad actually. It's really helpful."", ""Full of bugs! Can't use anymore. When I enter in a course section, it shows a empty field. When I tap certificate tabs & return to course, it shows course elements— videos, slides, pdfs & mcq tests; but not a single element can be accessed!"", ""Need to work on this app. Very poor experience even with paid course. Need to watch several times each video even after it doesn't recognise. In result, can't fulfil the dateline and get the certificate . It's tolerable with unpaid courses but for paid course it's very bad that you paid for the course and couldn't get the certificate even after reporting several times. Appreciate your effort but please remove this error."", 'All Things are good . But I think it has to upadte all the videos . Most Of the classes are recorded almost 1-2 years ago . The Questions are changed. Some new rule has added i think so . I hope you will update the classes soon. It is a very important and useful app. Keep growing . Love it.', ""it's really a great app but there a few subjects are added.. if there the subjects like psychology or social work are include.. then it's make me helpful.. I think you see my review and make the change.. Thank you.."", ""I don’t like the updated version.Actually, the previous version was good.I really liked the videos of previous version.Their teaching quality was good.I don't know why they replaced them.Now the lectures are boring.Also,the app stops working sometimes."", ""Everything is ok ,the videos are best but I couldn't download any video.at the first time 1 video was downloaded but after that ,no videos was downloaded.Infact,i reported that problem in those videos but couldn't get any feedback."", 'Most boring app. I think the app developer is not a professional one. Lots of bug there. Often shows a message like ""data is not loaded"". Have to face a lot of problems to watch any course videos though you have already paid for it. The course content is appreciated but dute to this problematic app you always feel suffer from it. A lot of improvement is needed. For a paid version people will not accept this', ""Actually i study in english medium school.....so it's quite difficult for us to get the question of quizzes in bengali and we also don't understand many terms.....so it would be much helpful if there would be an english version of this app.....or at least the quizzes should have an extra english version......however, i have been studying with 10 minutes school for many years and i had a great experience.....thanks for that❤️"", 'In the past,we would had some special notes on some particular words in the subjects like Biology. But now it has been disappeared, we strongly deny this.We would really like to have those special notes of different words as well as topic.Looking forward to get those back.', ""The app is great. But my problem is that when I play quiz; I will answer the question right but when I see in the result the answer I clicked that was not that. They show me the wrong one. Like if I click on option 2 they'll show I click another one. I think you should take a look. I have play different times but every time I face the same problem.."", 'This app is wonderful for students like me. But I think the classes could have been better, specially the science classes. And there is another thing that I want to mention. The first chapter of English 1st paper book of class 9-10 has been changed in 2021. But the classes and quizzes are still from the old book which is unfortunate. Please update the app as soon as the books are changed. Thank you.', 'Huge bugs in this app. During playing video if i do lock/unlock my phone then videos not playing properly. Have to restart again the app. And another problem is auto rotation. Please solve it', 'Bangladesh Best E-learning app ever ! The UI is amazing. Very user friendly. All courses and sectors are categorized as well. And also the course fee is affordable! Such a good app. Recommended ! ❤️', ""Really great app! I am lucky to have an app like this since I currently don't have any private tutor for now. one thing I wanna point out is that in the quiz section there's a little bug. like, sometimes I pick the answer is (i. ii.) but after completing quiz it says that I picked (i. iii.) and the correct answer was (i. ii.) when I originally picked (i. ii.)"", 'Everything is Awesome except the App. It could have been much better. It crashes everything now and then. Tried Uninstalling and Installing several times. It doesn\'t fix it. So Focus on the ""CRUSH"" issue of the app. I would also like to point out 2 thing 1. Why there is a 6 month time limit for every course? Do you honestly believe someone will buy it again after 6 month? You are just limiting the buyers and your company\'s POTENTIAL. 2. Where can I find the course\'s validity period? NOWHERE.', 'This app is very useful for students. As a student I liked the app a lot but the video uploaded here is about 1-2 years old. Now the syllabus has changed and so has the type of reading, so I hope you will upload new videos Take the test questions a little better. I give it 4 stars. Thanks', 'Best app for learning. I recommend it to my classmates and friends. It helps me a lot to enrich my knowledge and to test my learning skills. Especially, the quizzes based on subjects help me to prepare for exams and test my guts. And there is many courses available also. Thanks for making this app. Keep up good work.', 'This app is superb.But this app video downloads in internal storage. For this we have faceing some problem because of low storage. Please make a way to download video in Sd card. As a result, we can benefit more to study. Please solve this problem as fast as possible', ""It's really awesome and it's really helpful to read it on your own. They can solve any problem for us very easily.It works like my best friend at school. Thank you so much ten minute school and thank you so much all teacher's for you pretty guideline.....❤❤"", ""It’s the best apps in my case.Here you will find all subject. There are many learning apps,where you have to be admitted to learn.It costs a lot of money.So,this becomes very difficult for the poor talented students.But,the good news for them does not matter here.So this is definitely one of the best learning apps.So i told everyone to download this app now...It's very useful app for us....Thank you!!!!"", '10MS app is my daily driver app. I use it daily, this app need more ui improvement and polishing. Please add dark mode in app for long term use like blog reading. I hope 10ms team will hear my suggestion and also please add a option to unhide statusbar, this is so important to me. I hope you will implement these features to give us best user experience. 💞', ""The consents are really very effective and good for me. It helps me always. But the app is not good at all. Sometimes, I tap on one class, and it goes to other class. Sometimes 'technical problem' shows on the app. Sometimes 'no data found' shows on the app. Sometimes it creates problem to payment. I had to process 2/3 times for successfully payment. Sometimes it doesn't work good at the app even though there is a good Wifi connection. For these reason I gave 3★ otherwise I wanted to give 4/5★."", 'Can not enter into the courses which I have bought previously. Every people has this complain. It is not fair not to keep the process difficult. The system must be easier for general people. Your software should be updated.', ""When I see some course's video after seeing two and three video it appears that I have seen it, but 10-20Minutes later it again vanishes and says that I gave not seen it.It is happening by snd large.Please fix it"", ""It's very helping to our study. In short it's amaizing. Using this app, study is very easy. Thanks to ayman sadik for giving the gift 10 minute school.I am using this app. Really its very helping to study."", ""This app is Awesome for students.But there are lots of problems.When I'm downloading video they show me video download successful. But this Isn't download yet. And much thing irritating. Hope you guys solve those immediately."", ""My reason of giving this app 1 star is after purchasing a course it keep crashing, i reinstalled and restarted my phone but still not working, i can't even get in the app, please fix the problem asap."", 'This app is really good for students. Teachers are also good. This app has also developed very well. I always suggest my friend and cousins to use this app.💛', ""The results calculation of quiz exam is totally rubbish 😤😤. I gave all the correct answers but they made my correct answer wrong and put my answer is another option , that's why my score is also come down"", 'Everything is good. But I am facing problems to download the videos of ICT subject. These videos are undownloadable.😔😔', 'A Helpful app indeed.But my suggestion is to add the ""playback speed"" in the classes. It will save students time in urgency.', ""Fraud . They did not active the course after payment done , so many times contacted them to their support mail but ultimately they did not provided the course. Don't purchase any course from them ."", ""My daughter's favorite online learning/classes app....This app is very good for study....This app is one of the best app for study.And.There is also some courses which are very helpful...."", 'This is exceptionally very good app for students. Yah! I like this app so much because of having a lot of facilities over a School which is help me to spread my knowledge easily in anywhere....thanks a lot for them who are bringing up this facility for us.', 'Something wrong. After update the app it autocratic logout. When I log in manually the app starts work but I have lost all of my downloaded videos', 'This app is very useful. But if there is playback speed for every video it would more better and helpful. Hope to more better ( by adding playback speed) next time. Thanks a lot.']","['com.abidhasanapps.provasidrenglishvasashikha', 'com.oneous.bangladict', 'com.dictionary.bn', 'com.dic.bn', 'com.rksmobile.generalknowledgebangla']",https://play.google.com/store/apps/details?id=com.a10minuteschool.tenminuteschool&hl=en&gl=us
2,com.edtechworxapp,EdTech Worx,Pakistan's First Digital Interactive Platform.,5000,0.0,,0,22M,4.1,EdTech Worx,EdTech+Worx,Education,EDUCATION,https://play-lh.googleusercontent.com/9_ZI_SYU-odu5L-8yDn-OsqeZVcZ_K3H7uMdYIi5bzXi2u-V9pdJ-ZIe-Asnm3WFR9U,Everyone,False,"May 27, 2019",1593379728,1.0.29,"[""My classfellows and I prefer Teacher's content rather than this app because it is not easy to Access for us... There is different modules(chapters) then after clicking on one of them there is minimum 10 more modules (topics) then after clicking one of them there is another module( content) then we get to read some stuff which we all don't understand because of high level vocabulary and other reasons"", 'App is not working whenever I try to open this app it always shut down without even showing any interface', 'Sorry but the app has little lag and its crashes when i start reading course ......', ""Great app. Loved using. It's rlly helpful in educating one. Love it."", 'A great tool for educators and easy to use.', ""This app start and then sudanly stop, dosn't work on my mobile."", 'Errors in downloading', 'I can not sign up the app', 'Best for online assignments', 'Very nice and helpful', 'Really amazing app', 'This is a good app', 'Not a charming one', ""It's useful"", 'Working perfectly 👍', ""It's good"", 'V good', 'Good works', 'Good', 'Excellent', 'Good', 'Good', 'Nice', 'Wowwwww', 'Good', 'Good', 'Well']","['it.positec.landroid', 'com.scotts.lawnapp', 'com.holte.timev2', 'de.farmnet365.active', 'de.consoft.oventrop.ovapp']",https://play.google.com/store/apps/details?id=com.edtechworxapp&hl=en&gl=us
3,com.knowledgeplatform.lsc,Learn Smart Classroom,Pakistan’s leading K-12 digital learning solution for schools,10000,0.0,,0,8.8M,5.1,Knowledge Platform,Knowledge+Platform,Education,EDUCATION,https://play-lh.googleusercontent.com/3sRcNh3h0Ucn4ev9k9VtqXI2wCriJ3Lobsn9Fzy6uZ8C9RpxACjLSZH8YFHkk7Rizi0,Everyone,False,"Jun 1, 2020",1610354024,1.5.2,"['Soooo glitchy just stops working in middle of a test....... synchronization doesn\'t even works fricking takes hours for which I don\'t have time..........and also when we download some subject the pictures that are supposed to be in the mcqs are missing replaced with ""alpha"" ""beta"" gamma and delta and in maths where graphs are common so lotta options are in pictures which as ive said are missings so how the heck im supposed to answer.....using this because its the only option which honestly sucks', ""Really AwesomE and learningful app ,, if anyone want to learn something so everybody can learn a lot of this app.. ... thanks a lor.. I'm going to rate five stars because i can't see any other app which give these type of learning and results also........ THANK you so much....✓"", 'It is so good for students. For attending there classes in covid situation on this you can watch the video related to your subject and there topic and do the assignment also', ""This app isn't working. When ever i open this app it closes automatically"", 'Nice application safe, secure, easy and fast and thanks both knowledge platform and as well as AKU_EB and AKESP for this nice initiative.', 'This app helps understand each and every thing related our syllabus. Amazing application.........', 'This app is good for learning but this is too much slow please solve this problem as soon as possible', 'This is the best app i ever used .. It is also based on only our topics ..Thanks akesp🥳🥳🥳', 'It is a really excellent app for students', 'Nice,fast,secure and amazing app for understanding', 'Dumbest application ever. Such a slow and third class response', 'To much slow take lot of time to download files', 'Very bad app I have to learn now and do work and test', ""Can't find and option to sign up"", ""It's really great for students"", 'Never install this app because it is so slowly and third class', 'Creepy app coupe not edit class and profile', 'Main log in karna chahti thi lakin ye log in hi nahin ho raha it is worst app i am in love to give it 0 star but it is compulsory to give one star', 'No sign up option worst app ever', ""It's a very helpful app for the situation nowadays I'm fully satisfied 😊"", 'Best app for learning', 'The best method of learning', 'This app is very good 👍 app', 'Nice aap very helpful during qu arantine', 'Very helpful app ever bw lockdown', 'Great knowledge platform', 'Good app for learning', '😒😂🤣 this app is so bad dont use this app thanks.', 'This app is amazing i very like', 'This app is to slow', 'This app is very helpful', 'It is too usefull', 'This app is very good', 'To too bad and not to good', 'Daily Work is making me crazy uhh 🤕', 'This is very helpful 👍', 'VERY GOOD APP FOR STUDY', 'Not good app', 'Good for lear NH ing', 'I earn smart class 00 for']","['com.splashtop.classroom', 'com.teacherkit.app', 'com.tabnova.classroomapp', 'com.bodhiaiteacherflutter.in', 'com.classtag']",https://play.google.com/store/apps/details?id=com.knowledgeplatform.lsc&hl=en&gl=us
4,bd.com.prottoy,Prottoy - Visual Learning App,An Ed-Tech platform aiming to provide a world-class learning environment.,5000,0.0,,0,55M,5.0,Prottoy Edtech,Prottoy+Edtech,Education,EDUCATION,https://play-lh.googleusercontent.com/pWFO1IzPv_G9-NE336e-sdpqcpk7L1bmRpLYOZeM9F0nQCLH_LKdI_ln-mhEliYFbQ,Everyone,False,"Feb 21, 2021",1647431463,1.1.8,"[""Not gonna lie! This app is great! Here are animated concise videos for learning, theory material, and lots of practice with solutions!! The animations and the video contents are really good. What else does one need to fall in love with learning and that too, at Prottoy. Hats OFF, Prottoy Team. I would suggest every student give this a try. It'll help you a lot."", 'It has a huuuuge potential. Very nice UI. Most importantly each and every aspect of this application is well thought. Go through the materials again. Also adding the prodigy badge was uplifting. Wishing you guys all the best.', 'good app for exams, science only tho. I use it for ict', 'Some exam question are load half for that i can see the options and some time it takes many time for starting exams', ""I don't know anyone who is working behind the background.Whoever you are!!but honestly speaking you have done a great job by creating this kind of interface in this app.So many cool features,animated videos,tests,challanges,ranking,doubt clearing chatbox.All of these are just awesome.It's a Revolutionary educational app.Far better than any other educational app for Bangladeshi students till now."", 'No privacy policy has been shown up. It just wants me directly sign in with Google account. No option for Facebook or email or anything else.', 'When i go to take practice exam,the question doesn’t come on screen,they keep loading and loading.But the Start option doesn’t come...Only a few quizzes does start...Others keep loading', 'A great app! I would say a complete package. But you should hire some of the best teachers of bd. Though I am using it on trial mode, not gonna buy it. But you guys have done fabulous job.', 'Such a great Online Learning app🤩🤩🤩🤩🤩...... All the students of our country can learn many things by using this app... I have no idea who is working behind the background .... Whoever you are!! 😊😊😊 but I must say.. You have done a great job.. 😊😊', 'Got amazed with to video contents. Learning is very much simplified here. The app experience is also appreciable.', 'Great online learning app....☺ But giving 4 star, because the video quality could be regulated by giving a quality changing option.......😀', ""It got stucked on the loading screen. I think they should've make an optional web Interface instead of a buggy app :'("", ""Blessing for the people reading outside Dhaka where good teachers are hard to find. Really an amazing experience! Great educational app for Bangladesh till now!! I'm quite hopeful for this app! Specially, you can ask ques 24/7 there (best feature) Good luck!"", 'Where is physics chemistry and math 2nd paper????', 'A great platform for our country students. But I have a suggestion. Can you please add ""Playback speed""? I think it\'s needed.', ""I think the best part of this app is the QNA box.. That's really cool.. And the guys who answered the questions are really amazing.. And i find it so much helpful.."", ""Assalamu Alaikum. I downloaded the app, but while confirming my mobile number I didn't recieve any OTP & so I couldn't use the app. Note: Mobile number was correct.🙂"", 'Please help the English Medium students as well by providing the questions in English language.', 'Very helpful platform for my children. I recommend everyone to download and use Prottoy.', 'Excellent platform for the students. Loved the UI too much', 'This app will help HSC students simplifying their text books with visual contents.', ""This is really amazing. I'm very happy.I'll keep them in my prayer who are making this app.Salute our TEACHERS ❤️"", 'Really this app is great...it helps me to increase my knowledge and confidence.. thank you so much ..May Allah bless the owners ❤️❤️❤️', 'It is a great education platform 🥰', ""Would give more rating but can't even sign up.Backend work is too bad.It opens firebase link on browser lmao.Hope it will get better and better soon.Please lemme know after you've fix this.I'll change my rating maybe"", 'Best Useful App That I Have Ever Seen. Good Graphics.', ""Bangladesh's best learning app, hands down."", 'What an app ...many many best wishes for your Startup... ❤️', 'Excellent app for students ♥️', 'Thank you anjan bhaiya for giving us beautiful app prottoy visual learning', 'Such an incredible app and I like it so much.', ""This is what we are dreaming for. A very good initiative to enrich our educational resources. We dream that we will solve our own local problems by ourselves and by our own engineers.Great app. Wish you all the best Prottoy team.We will make our 'Sonar Bangla' one day."", 'This is a very much informative app.I love this.', ""It's a great app! I was greatly benefitted by it"", '5 star diya dilam.Ayon Vai ke amar torof theke ekta misty dia diyen.Really good app.Love it.But still under rated.Marketing team ki kore buji na......keu to chene e nah j eto valo paid educational platform bd te exist kore..', 'Beautiful platform in our Student life..', 'This app very good. But Money high', 'Doing extremely well for bengal edtech market.', ""It's best..... Nice arrangement....."", 'this app is very helpful.Thanks']",['com.becker.cpa2017'],https://play.google.com/store/apps/details?id=bd.com.prottoy&hl=en&gl=us
